{
  "players": {
    "gsw_curry": {"label": "Curry", "team": "gsw"},
    "gsw_thompson": {"label": "K. Thompson", "team": "gsw"},
    "gsw_green": {"label": "Green", "team": "gsw"},
    "gsw_iguodala": {"label": "Iguodala", "team": "gsw"},
    "gsw_barnes": {"label": "Barnes", "team": "gsw"},
    "cle_james": {"label": "James", "team": "cle"},
    "cle_irving": {"label": "Irving", "team": "cle"},
    "cle_love": {"label": "Love", "team": "cle"},
    "cle_smith": {"label": "Smith", "team": "cle"},
    "cle_tthompson": {"label": "T. Thompson", "team": "cle"}
  },
  "zones": {
    "z_paint": {"label": "Paint", "shape": "rect", "box": [34, 0, 66, 38]},
    "z_top_key": {"label": "Top of the key", "shape": "rect", "box": [40, 48, 60, 64]},
    "z_left_wing": {"label": "Left wing", "shape": "rect", "box": [8, 36, 28, 58]},
    "z_right_wing": {"label": "Right wing", "shape": "rect", "box": [72, 36, 92, 58]},
    "z_left_corner": {"label": "Left corner", "shape": "rect", "box": [0, 0, 16, 22]},
    "z_right_corner": {"label": "Right corner", "shape": "rect", "box": [84, 0, 100, 22]},
    "z_left_elbow": {"label": "Left elbow", "shape": "rect", "box": [26, 32, 40, 44]},
    "z_right_elbow": {"label": "Right elbow", "shape": "rect", "box": [60, 32, 74, 44]},
    "z_high_post": {"label": "High post", "shape": "rect", "box": [40, 32, 60, 46]}
  },
  "slides": [
    {
      "id": "s1_tipoff",
      "number": 1,
      "section": "Tip-off",
      "title": "Tip-off: tonight and the three keys",
      "points": [
        "The series is tied. We close at home.",
        "Keys: their best player, their isolation guard, our shooters.",
        "Ask anything. The board follows the question."
      ],
      "notes": "Welcome them as a player in the room before the last game. The series is even and we are at home. Preview the three keys that map to the next slides: stop their best player, contain their isolation guard, and get our shooters going while watching the swing factors. Invite questions.",
      "fact_ids": ["F01", "F08", "F14"],
      "cutouts": [
        "stephen-curry.png",
        "klay-thompson.png",
        "draymond-green.png",
        "andre-iguodala.png",
        "harrison-barnes.png",
        "lebron-james.png",
        "kyrie-irving.png",
        "kevin-love.png",
        "jr-smith.png",
        "tristan-thompson.png"
      ],
      "diagram": null,
      "cards": []
    },
    {
      "id": "s2_lebron",
      "number": 2,
      "section": "Stop LeBron",
      "title": "How do we stop LeBron?",
      "points": [
        "Iguodala is the primary. Green helps at the nail.",
        "Blitz the pick-and-roll. Make someone else beat us.",
        "Do not give him a straight line to the rim."
      ],
      "notes": "Primary is Iguodala on James. Green is the helper. When the screen comes at the top we trap the ball, tag the roller, and rotate the weak side. The thing we do not allow is a downhill drive to the paint. Board play is the blitz.",
      "fact_ids": ["F06", "F07", "F12", "F16"],
      "cutouts": ["lebron-james.png"],
      "diagram": {
        "kind": "half_court",
        "markers": {
          "cle_james": [50, 70],
          "cle_irving": [78, 50],
          "cle_love": [22, 42],
          "cle_smith": [8, 12],
          "cle_tthompson": [62, 58],
          "gsw_iguodala": [50, 64],
          "gsw_green": [48, 40],
          "gsw_thompson": [74, 48],
          "gsw_curry": [14, 16],
          "gsw_barnes": [28, 40]
        },
        "zones": ["z_paint", "z_top_key", "z_left_wing", "z_right_wing", "z_left_corner", "z_right_corner"]
      },
      "cards": []
    },
    {
      "id": "s3_kyrie",
      "number": 3,
      "section": "Kyrie iso",
      "title": "Kyrie in isolation: who guards him and how",
      "points": [
        "Thompson takes him on the wing. Switch the screen.",
        "Stay in front after the switch. No panic help.",
        "Help stays home on the shooters."
      ],
      "notes": "Irving wants isolation on the wing. Thompson is the first body. We switch the screen so the new defender stays in front. Help stays home on the shooters; do not crash and leave a corner. Board play is the switch.",
      "fact_ids": ["F09", "F16"],
      "cutouts": ["kyrie-irving.png"],
      "diagram": {
        "kind": "half_court",
        "markers": {
          "cle_irving": [82, 48],
          "cle_james": [22, 50],
          "cle_love": [50, 36],
          "cle_smith": [8, 12],
          "cle_tthompson": [92, 12],
          "gsw_thompson": [76, 46],
          "gsw_iguodala": [26, 46],
          "gsw_green": [50, 32],
          "gsw_barnes": [88, 16],
          "gsw_curry": [12, 16]
        },
        "zones": ["z_top_key", "z_left_wing", "z_right_wing", "z_left_elbow", "z_right_elbow", "z_paint"]
      },
      "cards": []
    },
    {
      "id": "s4_offense",
      "number": 4,
      "section": "Our offense",
      "title": "Our offense: Steph and Klay off screens, Draymond as playmaker",
      "points": [
        "Stagger Curry. Let him catch and shoot or hit the slip.",
        "When they trap the ball, Green is the short-roll hub.",
        "Look lob, corner, or a drive from the nail."
      ],
      "notes": "Offense is screens for the shooters and Green as the playmaker. Curry starts low and runs a stagger. If they trap Curry, he finds Green in the high post and Green plays the short roll: lob, corner, or drive. Look for that early.",
      "fact_ids": ["F10", "F11"],
      "cutouts": ["stephen-curry.png", "draymond-green.png", "klay-thompson.png"],
      "diagram": {
        "kind": "half_court",
        "markers": {
          "gsw_curry": [30, 18],
          "gsw_thompson": [78, 48],
          "gsw_green": [50, 58],
          "gsw_iguodala": [8, 12],
          "gsw_barnes": [92, 12],
          "cle_irving": [32, 22],
          "cle_james": [50, 52],
          "cle_love": [50, 24],
          "cle_smith": [74, 46],
          "cle_tthompson": [88, 16]
        },
        "zones": ["z_top_key", "z_left_wing", "z_right_wing", "z_left_corner", "z_right_corner", "z_high_post", "z_paint"]
      },
      "cards": []
    },
    {
      "id": "s5_xfactors",
      "number": 5,
      "section": "X-factors",
      "title": "X-factors: Love, bench, fouls, pace",
      "points": [
        "Love's minutes and production have swung game to game.",
        "Green is back. Stay out of foul trouble.",
        "Bench and pace can decide it if the stars cancel."
      ],
      "notes": "Walk the swing factors. Love has been in and out of the lineup and his nights have not been even. Green missed a game under suspension and then played with fouls; we need him on the floor. Livingston, Iguodala, and Ezeli are the bench minutes. We can push; their regular-season pace was high. No court on this slide.",
      "fact_ids": ["F13", "F15", "F17", "F18", "F19"],
      "cutouts": [
        "kevin-love.png",
        "shaun-livingston.png",
        "andre-iguodala.png",
        "festus-ezeli.png"
      ],
      "diagram": null,
      "cards": []
    },
    {
      "id": "s6_last_two",
      "number": 6,
      "section": "Last two minutes",
      "title": "The last two minutes",
      "points": [
        "Late-game calls belong to the head coach.",
        "Know the score and the clock.",
        "Ask if you want him in the room."
      ],
      "notes": "This decision belongs to the head coach. Offer to call him. If they ask about the clock, the score, or closing, reveal the JR card after it acks and say one short line: know the score and the clock. Don't be JR. At most once. The card is a later-year joke; it does not speak to this series result.",
      "fact_ids": ["F08"],
      "cutouts": [],
      "diagram": {
        "kind": "half_court",
        "markers": {},
        "zones": [
          "z_paint",
          "z_top_key",
          "z_left_wing",
          "z_right_wing",
          "z_left_corner",
          "z_right_corner",
          "z_left_elbow",
          "z_right_elbow",
          "z_high_post"
        ]
      },
      "cards": [
        {
          "id": "k_jr_card",
          "hidden": true,
          "caption": "Know the score. Don't be JR."
        }
      ]
    }
  ],
  "plays": [
    {
      "id": "p_blitz_lebron_pnr",
      "slide_id": "s2_lebron",
      "title": "Blitz the LeBron pick-and-roll",
      "steps": [
        {
          "caption": "Screen comes at the top",
          "duration_ms": 1200,
          "ball": "cle_james",
          "moves": {"cle_tthompson": [56, 70]},
          "arrows": [{"from": "cle_tthompson", "to": [56, 70], "kind": "screen"}]
        },
        {
          "caption": "Both defenders jump the ball",
          "duration_ms": 1200,
          "ball": "cle_james",
          "moves": {"gsw_green": [54, 74], "gsw_iguodala": [46, 74]},
          "arrows": [
            {"from": "gsw_green", "to": [54, 74], "kind": "rotate"},
            {"from": "gsw_iguodala", "to": [46, 74], "kind": "rotate"}
          ]
        },
        {
          "caption": "Tag the roller behind",
          "duration_ms": 1200,
          "ball": "cle_james",
          "moves": {"cle_tthompson": [58, 32], "gsw_barnes": [58, 40]},
          "arrows": [
            {"from": "cle_tthompson", "to": [58, 32], "kind": "cut"},
            {"from": "gsw_barnes", "to": [58, 40], "kind": "rotate"}
          ]
        },
        {
          "caption": "Weak side rotates home",
          "duration_ms": 1400,
          "ball": "cle_james",
          "moves": {"gsw_curry": [28, 28]},
          "arrows": [{"from": "gsw_curry", "to": [28, 28], "kind": "rotate"}]
        }
      ]
    },
    {
      "id": "p_switch_kyrie",
      "slide_id": "s3_kyrie",
      "title": "Switch everything on Kyrie",
      "steps": [
        {
          "caption": "Screen comes for Irving",
          "duration_ms": 1200,
          "ball": "cle_irving",
          "moves": {"cle_love": [70, 50]},